id;company;calc_type;calc_value;unit;threshold_type;threshold_value;threshold_unit;thresholds_all;thresholds_count;treatment_stop;adverse_effects;treatment_failure;cotreatments;cashback_extract
2127;Bristol-Myers Squibb SA;percentage;29.58;per_box;;;;;0;0;0;0;"[""OPDIVO""]";Pour le traitement du carcinome à cellules rénales, Bristol-Myers Squibb SA rembourse, sur demande, à l’assureur maladie auprès duquel le patient était assuré au moment où il a reçu le médicament, 29.58% du prix de fabrique par boîte ou par mg d’OPDIVO administré de manière prouvée pour un CCR.
2128;Bristol-Myers Squibb SA;percentage;2.32;per_box;;;;;0;0;0;0;"[""OPDIVO""]";Pour le traitement du lymphome de Hodgkin classique, Bristol-Myers Squibb SA rembourse, sur demande, à l’assureur maladie auprès duquel le patient était assuré au moment où il a reçu le médicament, 2.32% du prix de fabrique par boîte ou par mg d’OPDIVO administré de manière prouvée pour un LHc.
2129;Bristol-Myers Squibb SA;percentage;23.03;per_box;;;;;0;0;0;0;"[""OPDIVO""]";Pour le traitement du CRC avec dMMR/MSI-H, Bristol-Myers Squibb SA rembourse, sur demande, à l’assureur maladie auprès duquel le patient était assuré au moment où il a reçu le médicament, 23.03% du prix de fabrique par boîte ou par mg d’OPDIVO administré de manière prouvée pour un CRC.
2131;Novartis Pharma Schweiz AG;percentage;21.36;per_box;;;;;0;0;0;0;"[""REVOLADE""]";Novartis Pharma Schweiz AG remboursera à l’assureur-maladie 21,36% du prix de fabrique par boîte de Revolade sur demande de l’assureur-maladie auprès duquel la personne assurée était assurée au moment de l’achat.
2134;Swedish Orphan Biovitrum AG;amount_unspecified;;per_box;;;;;0;0;0;0;"[""TEGSEDI""]";Sur demande de l’assurance-maladie de l’assuré au moment de l’achat, le titulaire de l’autorisation, Swedish Orphan Biovitrum AG, remboursera un montant fixe du prix ex-factory pour chaque boîte de Tegsedi achetée. La TVA ne peut pas être réclamée en plus de cette partie du prix ex-factory.
2136;Takeda Pharma AG;percentage;9.079;per_box;;;;;0;0;0;0;"[""ALUNBRIG""]";Dans le cadre de l'utilisation d'ALUNBRIG post-crizotinib, Takeda Pharma AG remboursera à l'assureur maladie, auprès duquel la personne assurée était assuré au moment de l'achat, 9.079% du prix de fabrique pour chaque emballage d'ALUNBRIG acheté, à la demande de l'assureur maladie. Le remboursement de la taxe sur la valeur ajoutée ne peut pas être exigé en sus de ce montant. La demande de remboursement est faite à partir de la date de l'administration.
2140;La société OrphaSwiss GmbH;amount_unspecified;;per_box;;;;;0;0;0;0;"[""BESREMI""]";La société OrphaSwiss GmbH rembourse, sur demande de la caisse maladie auprès de laquelle le ou la patient(e) est assuré(e) au moment de la prise en charge, un montant forfaitaire sur le prix de fabrique de chaque boîte de BESREMI utilisée dans la cadre du traitement. Le remboursement de la TVA ne peut pas être réclamé en plus de cette part du prix de fabrique.
2141;Accord Healthcare SA;unknown;;unknown;;;;;0;1;0;0;"[""CABAZITAXEL ACCORD""]";En cas d'arrêt de la thérapie avant le 2ème cycle de Cabazitaxel Accord, la firme Accord Healthcare SA remboursera au payeur, sur demande de l'assureur, les coûts de la dose de Cabazitaxel Accord administrée pour le 1er cycle en termes de prix public.
2145;Janssen-Cilag AG;unknown;;per_box;;;;;0;0;0;0;"[""DARZALEX""]";Janssen-Cilag AG rembourse à l’assureur-maladie auprès duquel la personne était assurée au moment de la remise du médicament, dès la première demande de l’assureur, une part convenue du prix de fabrique pour chaque emballage remis de DARZALEX.
2149;Roche Pharma (Suisse) SA;undisclosed_fixed;;per_box;;;;;0;0;0;0;"[""EVRYSDI""]";A la première demande de l’assurance-maladie ou de l’assurance invalidité auprès de laquelle la personne concernée est assurée au moment de la remise, le titulaire de l'autorisation, Roche Pharma (Suisse) SA, rembourse à cette caisse une part fixe du prix de fabrique pour chaque emballage d’EVRYSDI remis.
2151;Gilead Sciences Suisse Sàrl;chf_fixed;14.0;unknown;treatment_of_duration;12;weeks;"[{""type"": ""treatment_of_duration"", ""value"": 12, ""unit"": ""weeks"", ""match"": ""traitement de 12 semaines""}]";1;0;0;0;"[""HARVONI""]";Dans le cas d’un traitement de 12 semaines par Harvoni, Gilead Sciences Suisse Sàrl remboursera, sur demande de l’assureur maladie chez lequel la personne assurée était assurée à la date de la délivrance du médicament, le prix de fabrique de la troisième boîte du médicament – soit CHF 14'034.42 – si son administration au patient est établie. Un remboursement de la TVA en plus de la somme susmentionnée est exclu. La demande de remboursement doit être effectuée à partir du début de l’administration.
2152;Pfizer AG;undisclosed_fixed;;per_box;;;;;0;0;0;0;"[""IBRANCE""]";Sur demande, Pfizer AG rembourse à l’assureur qui couvrait l’assurée au moment de l’achat une partie fixe du prix de fabrication pour chaque boîte d’Ibrance achetée.
2153;la firme sanofi-aventis (suisse) sa;unknown;;unknown;;;;;0;1;0;0;"[""JEVTANA""]";En cas d'arrêt de la thérapie avant le 2ème cycle de Jevtana, la firme sanofi-aventis (suisse) sa remboursera au payeur, sur demande de l'assureur, les coûts de la dose de Jevtana administrée pour le 1er cycle en termes de prix public.
2157;;percentage;50.0;unknown;from_month;25;months;"[{""type"": ""from_month"", ""value"": 25, ""unit"": ""months"", ""match"": ""à partir de 25 mois""}, {""type"": ""exceeding"", ""value"": 24, ""unit"": ""months"", ""match"": ""supérieure à 24 mois""}]";2;0;0;0;"[""LYNPARZA""]";Pour les patientes avec une tumeur résiduelle mesurable après un traitement d’une durée supérieure à 24 mois (à partir de 25 mois), la titulaire de l’autorisation rembourse 50% du prix départ usine pour l’achat de toute boîte supplémentaire de Lynparza, sur demande de la caisse d’assurance-maladie auprès duquel l’assuré était assuré au moment de l’achat.
2158;;percentage;50.0;unknown;from_month;25;months;"[{""type"": ""from_month"", ""value"": 25, ""unit"": ""months"", ""match"": ""à partir du 25e mois""}, {""type"": ""exceeding"", ""value"": 24, ""unit"": ""months"", ""match"": ""supérieure à 24 mois""}]";2;0;0;0;"[""LYNPARZA""]";Pour une durée de traitement supérieure à 24 mois (à partir du 25e mois), le titulaire de l’autorisation rembourse 50% du prix départ usine pour tout emballage supplémentaire de Lynparza acheté, sur demande de l’assurance-maladie auprès de laquelle la personne concernée est assurée au moment de l’achat. Le remboursement de la préparation de bévacizumab utilisée en association avec Lynparza est défini dans la limitation de la préparation de bévacizumab.
2160;Bristol-Myers Squibb SA;percentage;16.98;per_box;;;;;0;0;0;0;"[""YERVOY"", ""OPDIVO""]";Pour le traitement du mélanome combiné avec YERVOY, Bristol-Myers Squibb SA rembourse, sur demande, à l’assureur maladie auprès duquel le patient était assuré au moment où il a reçu le médicament, 16.98% du prix de fabrique par boîte ou par mg d’OPDIVO et d’YERVOY administré de manière prouvée pour un mélanome.
2162;Bristol-Myers Squibb SA;percentage;2.32;per_box;;;;;0;0;0;0;"[""OPDIVO"", ""YERVOY""]";Pour le traitement du mélanome, Bristol-Myers Squibb SA rembourse pour chaque patient, après demande de l’assureur maladie auprès duquel la personne concernée était assurée au moment de l’achat, 2.32% du prix de fabrique par boîte ou par mg d’OPDIVO et d’YERVOY administré de manière prouvée pour un mélanome.
2163;Bristol-Myers Squibb SA;percentage;2.32;per_box;;;;;0;0;0;0;"[""OPDIVO""]";Pour le traitement du mélanome adjuvant, Bristol-Myers Squibb SA rembourse, sur demande, à l’assureur maladie auprès duquel le patient était assuré au moment où il a reçu le médicament, 2.32% du prix de fabrique par boîte ou par mg d’OPDIVO administré de manière prouvée pour un mélanome adjuvant.
2164;Bristol-Myers Squibb SA;percentage;29.58;per_box;;;;;0;0;0;0;"[""OPDIVO""]";Pour le traitement du carcinome à cellules rénales, Bristol-Myers Squibb SA rembourse, sur demande, à l’assureur maladie auprès duquel le patient était assuré au moment où il a reçu le médicament, 29.58% du prix de fabrique par boîte ou par mg d’OPDIVO administré de manière prouvée pour un CCR.
2166;Bristol-Myers Squibb SA;percentage;2.32;per_box;;;;;0;0;0;0;"[""OPDIVO""]";Pour le traitement du lymphome de Hodgkin classique, Bristol-Myers Squibb SA rembourse, sur demande, à l’assureur maladie auprès duquel le patient était assuré au moment où il a reçu le médicament, 2.32% du prix de fabrique par boîte ou par mg d’OPDIVO administré de manière prouvée pour un LHc.
2167;Bristol-Myers Squibb SA;percentage;23.03;per_box;;;;;0;0;0;0;"[""OPDIVO""]";Pour le traitement du CRC avec dMMR/MSI-H, Bristol-Myers Squibb SA rembourse, sur demande, à l’assureur maladie auprès duquel le patient était assuré au moment où il a reçu le médicament, 23.03% du prix de fabrique par boîte ou par mg d’OPDIVO administré de manière prouvée pour un CRC.
2169;La société Vertex Pharmaceuticals (CH) GmbH;amount_unspecified;;per_box;;;;;0;0;0;0;"[""ORKAMBI""]";La société Vertex Pharmaceuticals (CH) GmbH rembourse à l’assureur chez lequel la personne assurée était assurée au moment de la prise en charge, ou à l’AI respectivement, sur demande une part définie du prix de fabrication pour chaque boîte d’ORKAMBI administrée. La demande du remboursement de la TVA sur ce montant n’est pas admissible.
2170;La société Vertex Pharmaceuticals (CH) GmbH;amount_unspecified;;per_box;;;;;0;0;0;0;"[""ORKAMBI""]";La société Vertex Pharmaceuticals (CH) GmbH rembourse à l’assureur chez lequel la personne assurée était assurée au moment de la prise en charge, ou à l’AI respectivement, sur demande une part définie du prix de fabrication pour chaque boîte d’ORKAMBI administrée. La demande du remboursement de la TVA sur ce montant n’est pas admissible.
2180;La société Vertex Pharmaceuticals (CH) GmbH;amount_unspecified;;per_box;;;;;0;0;0;0;"[""SYMDEKO""]";Le traitement ne doit être poursuivi au-delà de 6 et 12 mois qu’en cas: • d’absence de détérioration persistante de la fonction pulmonaire par rapport à la valeur initiale OU • de réduction du nombre d’exacerbations pulmonaires cliniquement pertinentes (avec hospitalisation, traitement antibiotique i.v.) La société Vertex Pharmaceuticals (CH) GmbH rembourse à l’assurance maladie chez laquelle la personne assurée était assurée au moment de la prise en charge, ou à l’AI, respectivement, sur demande une part définie du prix de fabrication pour chaque boîte de SYMDEKO administrée. La demande du remboursement de la TVA sur ce montant n’est pas admissible.
2181;La société Vertex Pharmaceuticals (CH) GmbH;amount_unspecified;;per_box;;;;;0;0;0;0;;Le traitement ne doit être poursuivi au-delà de 6 et 12 mois qu’en cas: • d’absence de détérioration persistante de la fonction pulmonaire par rapport à la valeur initiale OU • de réduction du nombre d’exacerbations pulmonaires cliniquement pertinentes (avec hospitalisation, traitement antibiotique i.v.) La société Vertex Pharmaceuticals (CH) GmbH rembourse à l’assurance maladie chez laquelle la personne assurée était assurée au moment de la prise en charge, ou à l’AI, respectivement, sur demande une part définie du prix de fabrication pour chaque boîte administrée. La demande du remboursement de la TVA sur ce montant n’est pas admissible.
2183;Pfizer AG;unknown;;per_box;during_months;6;months;"[{""type"": ""during_months"", ""value"": 6, ""unit"": ""months"", ""match"": ""pendant 6 mois""}]";1;0;0;0;"[""VYNDAQEL""]";"hospitalisations répétées pour décompensation cardiaque); - une baisse des performances pendant 6 mois, associée à une élévation de NT-proBNP et à une augmentation de la consommation de diurétiques - si le patient développe une insuffisance cardiaque de classe NYHA III ou IV malgré un traitement optimal - une réduction cliniquement significative de la distance de marche au test de marche de 6 minutes - une transplantation cardiaque ou hépatique - l’implantation de «mechanic assist devices» (LVAD, RVAD, BiVAD) Pour chaque emballage de 30 capsules molles de VYNDAQEL de 61 mg, la titulaire de l’autorisation, Pfizer AG, rembourse sur demande de l’assureur-maladie auprès duquel était assurée la personne au moment de l’achat un pourcentage fixe du prix de fabrication."
2184;MSD Merck Sharp & Dohme AG;chf_fixed;9.0;unknown;treatment_of_duration;16;weeks;"[{""type"": ""treatment_of_duration"", ""value"": 16, ""unit"": ""weeks"", ""match"": ""traitement de 16 semaines""}]";1;0;0;0;"[""ZEPATIER""]";Lors d'un traitement de 16 semaines avec Zepatier, à la demande de la caisse maladie chez qui la personne assurée était affiliée au moment de la perception, MSD Merck Sharp & Dohme AG rembourse le prix de fabrique de Fr. 9’095.80 du quatrième emballage administré de manière démontrable. La taxe sur la valeur ajoutée ne peut pas être récupérée en sus de ce montant. La demande de remboursement doit être effectuée à partir du début de l’administration.
2185;;full_refund_pex;;unknown;;;;;0;0;0;0;"[""LYNPARZA"", ""ZIRABEV""]";À la première demande de l’assurance-maladie auprès de laquelle la personne concernée est assurée au moment de l’achat, le titulaire de l’autorisation de Zirabev rembourse à cette caisse une part fixe du prix départ usine pour tout emballage de Zirabev acheté et utilisé en association avec Lynparza.
2187;Sandoz Pharmaceuticals AG;full_refund;;unknown;;;;;0;1;1;0;;En cas d’arrêt du traitement rendu nécessaire par des effets indésirables survenus au cours des 10 jours suivant le début du traitement, Sandoz Pharmaceuticals AG remboursera à l’assureur-maladie les coûts de la totalité de l’emballage.
2188;Spirig HealthCare AG;full_refund;;unknown;;;;;0;1;1;0;;En cas d’arrêt du traitement rendu nécessaire par des effets indésirables survenus au cours des 10 jours suivant le début du traitement, Spirig HealthCare AG remboursera à l’assureur-maladie les coûts de la totalité de l’emballage.
2191;;unknown;;per_box;;;;;0;0;0;0;"[""PERTUZUMAB"", ""HERCEPTIN"", ""PERJETA""]";En ce qui concerne le remboursement d’HERCEPTIN dans cette combinaison s’applique en plus la limitation suivante: Sur première demande de l’assureur-maladie auprès duquel la personne était assurée au moment de l’achat, le titulaire de l’autorisation rembourse à l’assureur-maladie une partie déterminée du prix de fabrique pour chaque boîte d’HERCEPTIN en association avec le pertuzumab (PERJETA) achetée dans le cadre d’un traitement adjuvant (post-opératoire).
2192;;unknown;;per_box;;;;;0;0;0;0;"[""PERTUZUMAB"", ""HERZUMA"", ""PERJETA""]";En ce qui concerne le remboursement d’HERZUMA dans cette combinaison s’applique en plus la limitation suivante: Sur première demande de l’assureur-maladie auprès duquel la personne était assurée au moment de l’achat, le titulaire de l’autorisation rembourse à l’assureur-maladie une partie déterminée du prix de fabrique pour chaque boîte d’HERZUMA en association avec le pertuzumab (PERJETA) achetée dans le cadre d’un traitement adjuvant (post-opératoire).
2194;AbbVie AG;chf_fixed;14.0;per_box;;;;;0;0;0;0;"[""MAVIRET""]";Dans le cas d’un traitement de 12 ou 16 semaines avec MAVIRET®, AbbVie AG remboursera, sur demande de l’assureur maladie chez lequel la personne assurée était assurée à la date de la délivrance du médicament, le prix de fabrique du troisième/quatrième emballage – soit CHF 14'407.03 par emballage – si son administration au patient est démontrée. Un remboursement de la TVA en plus de la somme susmentionnée est exclu. La demande de remboursement doit être effectuée à partir du début de l’administration.
2195;;unknown;;per_box;;;;;0;0;0;0;"[""PERTUZUMAB"", ""OGIVRI"", ""PERJETA""]";En ce qui concerne le remboursement d’OGIVRI dans cette combinaison s’applique en plus la limitation suivante: Sur première demande de l’assureur-maladie auprès duquel la personne était assurée au moment de l’achat, le titulaire de l’autorisation rembourse à l’assureur-maladie une partie déterminée du prix de fabrique pour chaque boîte d’OGIVRI en association avec le pertuzumab (PERJETA) achetée dans le cadre d’un traitement adjuvant (post-opératoire).
2196;;unknown;;per_box;;;;;0;0;0;0;"[""PERTUZUMAB"", ""OGIVRI"", ""PERJETA""]";En ce qui concerne le remboursement d’OGIVRI dans cette combinaison s’applique en plus la limitation suivante: Sur première demande de l’assureur-maladie auprès duquel la personne était assurée au moment de l’achat, le titulaire de l’autorisation rembourse à l’assureur-maladie une partie déterminée du prix de fabrique pour chaque boîte d’OGIVRI en association avec le pertuzumab (PERJETA) achetée dans le cadre d’un traitement adjuvant (post-opératoire).
2197;Roche Pharma (Suisse) SA;chf_fixed;627.98;per_box;;;;;0;0;0;0;"[""PERJETA""]";Sur première demande de l’assureur-maladie auprès duquel la personne était assurée au moment de l’achat, le titulaire de l’autorisation Roche Pharma (Suisse) SA rembourse la somme de 627.98 francs à l’assureur-maladie pour chaque boîte de Perjeta achetée en cas d’un cancer du sein métastatique. La taxe sur la valeur ajoutée ne peut pas être exigée en sus de cette partie du prix de fabrique. La demande de remboursement doit intervenir à partir du moment de l’administration.
2198;Roche Pharma (Suisse) SA;chf_fixed;702.71;per_flacon;flat_fee_unique;;flat_fee;"[{""type"": ""flat_fee_unique"", ""value"": null, ""unit"": ""flat_fee"", ""match"": ""montant forfaitaire unique""}]";1;0;0;0;"[""PERJETA""]";Sur première demande de l’assureur-maladie auprès duquel la personne était assurée au moment de l’achat (début du traitement), le titulaire de l’autorisation Roche Pharma (Suisse) SA rembourse un montant forfaitaire unique sur la combinaison de Perjeta et du trastuzumab de 6'702.71 francs par cas de néoadjuvant ou patient. Le remboursement est indépendant du nombre réel de cycles thérapeutiques néoadjuvants et ne peut être combiné à des remboursements supplémentaires par flacon. La taxe sur la valeur ajoutée ne peut pas être exigée en sus de cette partie du prix de fabrique. La demande de remboursement doit intervenir à partir du moment de l’administration.
2199;Roche Pharma (Suisse) SA;unknown;;per_box;;;;;0;0;0;0;"[""PERJETA""]";Sur première demande de l’assureur-maladie auprès duquel la personne était assurée au moment de l’achat, le titulaire de l’autorisation Roche Pharma (Suisse) SA et le titulaire de l’autorisation pour le trastuzumab remboursent à l’assureur-maladie une partie déterminée du prix de fabrique pour chaque boîte de Perjeta et de trastuzumab achetée dans le cadre d’un traitement adjuvant (post-opératoire).
2203;;unknown;;per_box;;;;;0;0;0;0;"[""PERTUZUMAB"", ""TRAZIMERA"", ""PERJETA""]";En ce qui concerne le remboursement de TRAZIMERA dans cette combinaison s’applique en plus la limitation suivante: Sur première demande de l’assureur-maladie auprès duquel la personne était assurée au moment de l’achat, le titulaire de l’autorisation rembourse à l’assureur-maladie une partie déterminée du prix de fabrique pour chaque boîte de TRAZIMERA en association avec le pertuzumab (PERJETA) achetée dans le cadre d’un traitement adjuvant (post-opératoire).
2208;Roche Pharma (Suisse) SA;chf_fixed;0.85;per_mg;;;;;0;0;0;1;"[""AVASTIN""]";Dans cette indication, sur demande de l’assureur-maladie chez qui la personne était assurée au moment de l’achat, Roche Pharma (Suisse) SA rembourse pour le traitement Fr. 0.85 par mg d’Avastin. En cas de prescription médicale appropriée, Avastin est remboursé jusqu’à progression de la maladie. La taxe sur la valeur ajoutée ne peut pas être exigée en sus de ce montant. La demande de remboursement doit intervenir en règle générale dans les 3 mois qui suivent l’administration.
2210;;full_refund_pex;;per_box;;;;;0;0;0;0;"[""AVASTIN"", ""TECENTRIQ""]";En ce qui concerne le remboursement d’AVASTIN dans cette indication respecter également la limitation suivante: Le titulaire de l’autorisation rembourse à l’assureur-maladie auprès duquel était assurée la personne au moment de l’achat, et sur première demande de celui-ci, une part définie du prix départ usine pour chaque boîte d'AVASTIN en association avec de l'atézolizumab (TECENTRIQ) acquise pour l’indication du traitement du CHC.
2213;Janssen-Cilag AG;cost_refund;;unknown;not_beyond;4;weeks;"[{""type"": ""not_beyond"", ""value"": 4, ""unit"": ""weeks"", ""match"": ""ne se poursuit pas au-delà des 4 semaines""}]";1;0;0;0;"[""DARZALEX""]";Si le traitement ne se poursuit pas au-delà des 4 semaines initiales, la société Janssen-Cilag AG remboursera, sur demande de l’assureur-maladie auprès de qui la personne assurée était assurée au moment de l’achat, les coûts correspondant aux emballages remis jusqu’à ce moment-là ou aux quantités de Darzalex administrées. La TVA ne peut pas être remboursée en plus de ce montant. La demande de remboursement doit normalement être effectuée dans les 6 mois.
2214;Janssen-Cilag AG;amount_unspecified;;unknown;;;;;0;0;0;0;;Dans cette indication, Janssen-Cilag AG remboursera un montant fixe du prix de fabrique du traitement à la demande de l'assureur-maladie auprès duquel le patient était assuré au moment de l’administration du traitement. La TVA ne peut pas être réclamée en sus de ce montant du prix de fabrique.
2215;Janssen-Cilag SA;unknown;;per_box;;;;;0;0;0;0;"[""DARZALEX""]";À la demande de l'assureur-maladie auprès duquel le patient était assuré au moment de l’achat, Janssen-Cilag SA remboursera une proportion fixe du prix de fabrique pour chaque emballage de DARZALEX. La TVA ne peut pas être réclamée en plus de cette réduction sur le prix de fabrique.
2217;Janssen-Cilag AG;cost_refund;;unknown;not_beyond;4;weeks;"[{""type"": ""not_beyond"", ""value"": 4, ""unit"": ""weeks"", ""match"": ""ne se poursuit pas au-delà des 4 semaines""}]";1;0;0;0;"[""DARZALEX""]";Si le traitement ne se poursuit pas au-delà des 4 semaines initiales, la société Janssen-Cilag AG remboursera, sur demande de l’assureur-maladie auprès de qui la personne assurée était assurée au moment de l’achat, les coûts correspondant aux emballages remis jusqu’à ce moment-là ou aux quantités de Darzalex administrées. La TVA ne peut pas être remboursée en plus de ce montant. La demande de remboursement doit normalement être effectuée dans les 6 mois.
2218;Janssen-Cilag AG;amount_unspecified;;unknown;;;;;0;0;0;0;;Dans cette indication, Janssen-Cilag AG remboursera un montant fixe du prix de fabrique du traitement à la demande de l'assureur-maladie auprès duquel le patient était assuré au moment de l’administration du traitement. La TVA ne peut pas être réclamée en sus de ce montant du prix de fabrique.
2219;Janssen-Cilag SA;unknown;;per_box;;;;;0;0;0;0;"[""DARZALEX""]";À la demande de l'assureur-maladie auprès duquel le patient était assuré au moment de l’achat, Janssen-Cilag SA remboursera une proportion fixe du prix de fabrique pour chaque emballage de DARZALEX. La TVA ne peut pas être réclamée en plus de cette réduction sur le prix de fabrique.
2221;Janssen-Cilag AG;unknown;;per_box;;;;;0;0;0;0;"[""DARZALEX"", ""DARZALEX SC""]";Janssen-Cilag AG rembourse à l’assureur-maladie auprès duquel la personne était assurée au moment de la remise du médicament, dès la première demande de l’assureur, une part convenue du prix de fabrique pour chaque emballage remis de DARZALEX SC. Le remboursement de la TVA ne peut pas être réclamé en plus de cette part du prix de fabrique.
2225;Celgene GmbH;undisclosed_fixed;;per_box;;;;;0;0;0;0;"[""IMNOVID""]";Sur demande de l’assurance maladie, auprès duquel la personne était assurée lorsque IMNOVID lui a été délivré, Celgene GmbH rembourse une part fixe du prix de fabrique pour chaque emballage de IMNOVID acheté. Le remboursement de la TVA ne peut pas être exigée en plus de ce pourcentage du prix de fabrique.
2226;Recordati SA;undisclosed_fixed;;per_box;;;;;0;0;0;0;"[""ISTURISA""]";Pour chaque emballage d'Isturisa acheté, Recordati SA rembourse, dès la première demande de l’assureur, une partie fixe du prix de fabrication à l'assurance maladie auprès de laquelle la personne était assurée au moment de la remise du médicament. La TVA ne peut pas faire l’objet d’une demande de remboursement en plus de cette partie du prix de fabrication.
2227;;unknown;;per_box;;;;;0;0;0;0;"[""PERTUZUMAB"", ""KANJINTI"", ""PERJETA""]";En ce qui concerne le remboursement de KANJINTI dans cette combinaison s’applique en plus la limitation suivante: Sur première demande de l’assureur-maladie auprès duquel la personne était assurée au moment de l’achat, le titulaire de l’autorisation rembourse à l’assureur-maladie une partie déterminée du prix de fabrique pour chaque boîte de KANJINTI en association avec le pertuzumab (PERJETA) achetée dans le cadre d’un traitement adjuvant (post-opératoire).
